{
  "$schema": "https://json-schema.org/draft/2020-12/schema",
  "$id": "https://hooshix.internal/schemas/mlops/governance-v2.json",
  "title": "HooshiX approved staging model-execution governance v2",
  "type": "object",
  "additionalProperties": false,
  "required": ["schema_version", "governance_version", "decision_status", "model_catalog", "prompt_catalog", "price_catalog", "promotion_policy", "safety_policy", "provider_data_controls", "feedback_policy", "drift_policy"],
  "properties": {
    "schema_version": {"const": 2},
    "governance_version": {"type": "string", "pattern": "^[0-9]+\\.[0-9]+\\.[0-9]+$"},
    "decision_status": {"const": "APPROVED_STAGING_CANARY"},
    "model_catalog": {"type": "array", "minItems": 1},
    "prompt_catalog": {"type": "array", "minItems": 1},
    "price_catalog": {"type": "array", "minItems": 1},
    "promotion_policy": {"type": "object"},
    "safety_policy": {"type": "object"},
    "provider_data_controls": {"type": "object"},
    "feedback_policy": {"type": "object"},
    "drift_policy": {"type": "object"}
  }
}
